{
  "detected_assets": [
    "agents_md (e.g., AGENTS.md)",
    "ide_rules (e.g., .cursor/rules)",
    ".github/workflows",
    "docs",
    "tests",
    "package.json"
  ],
  "detected_risks": [],
  "inferred_mode": "brownfield_project",
  "inferred_managed_scope": {
    ".atrakta/audit/**": "managed_block",
    ".atrakta/canonical/**": "managed_block",
    ".atrakta/generated/**": "managed_block",
    ".atrakta/state/**": "managed_block",
    ".cursor/**": "proposal_patch_only",
    "agents_md (e.g., AGENTS.md)": "proposal_patch_only",
    "docs/generated/**": "managed_include"
  },
  "inferred_capabilities": [
    "generate_repo_map",
    "inspect_drift",
    "inspect_integration",
    "inspect_parity",
    "inspect_repo",
    "propose_repair",
    "read_config",
    "run_tests",
    "search_docs"
  ],
  "inferred_guidance_strength": {
    "agents_md": "advisory_map",
    "canonical_policy": "authoritative_constraint",
    "ide_rules": "tool_hint",
    "repo_docs": "advisory_map",
    "workflow_binding": "orchestration_constraint"
  },
  "inferred_default_policy": {
    "destructive": "deny",
    "external_send": "deny",
    "local_write": "proposal_only",
    "managed_bootstrap_apply": "proposal_only",
    "read_only": "allow",
    "unknown_capability": "strict",
    "unmapped_guidance": "advisory_only"
  },
  "inferred_failure_routing": {
    "failure_class": "legacy_conflict_failure",
    "scope": "workspace",
    "triggers": [
      "instruction_conflict",
      "policy_ambiguity"
    ],
    "default_tier": "DEGRADE_TO_STRICT",
    "resolved_tier": "DEGRADE_TO_STRICT",
    "strict_transition": "strict",
    "requires_human_review": true,
    "execution_allowed": false,
    "projection_allowed": true,
    "next_allowed_action": "inspect"
  },
  "conflicts": [
    "possible duplicate guidance: agents_md (e.g., AGENTS.md) and ide_rules (e.g., .cursor/rules)"
  ],
  "suggested_next_actions": [
    "review conflicts",
    "inspect details",
    "accept defaults",
    "export proposal only"
  ]
}
