{
  "detected_assets": [
    ".github/workflows",
    "docs",
    "tests"
  ],
  "detected_risks": [],
  "inferred_mode": "brownfield_project",
  "inferred_managed_scope": {
    ".atrakta/audit/**": "managed_block",
    ".atrakta/canonical/**": "managed_block",
    ".atrakta/generated/**": "managed_block",
    ".atrakta/state/**": "managed_block",
    "docs/generated/**": "managed_include"
  },
  "inferred_capabilities": [
    "generate_repo_map",
    "inspect_drift",
    "inspect_integration",
    "inspect_parity",
    "inspect_repo",
    "propose_repair",
    "read_config",
    "run_tests",
    "search_docs"
  ],
  "inferred_guidance_strength": {
    "canonical_policy": "authoritative_constraint",
    "repo_docs": "advisory_map",
    "workflow_files": "orchestration_constraint"
  },
  "inferred_default_policy": {
    "destructive": "deny",
    "external_send": "deny",
    "local_write": "proposal_only",
    "managed_bootstrap_apply": "proposal_only",
    "read_only": "allow",
    "unknown_capability": "strict",
    "unmapped_guidance": "advisory_only"
  },
  "inferred_failure_routing": {
    "failure_class": "projection_failure",
    "scope": "workspace",
    "triggers": [],
    "default_tier": "WARN_ONLY",
    "resolved_tier": "WARN_ONLY",
    "strict_transition": "none",
    "requires_human_review": false,
    "execution_allowed": true,
    "projection_allowed": true,
    "next_allowed_action": "inspect"
  },
  "conflicts": [],
  "suggested_next_actions": [
    "inspect details",
    "accept defaults",
    "export proposal only"
  ]
}
